{
  "schema_version": 1,
  "protocol_id": "pilot-smoke-v1",
  "status": "proposed",
  "phase": "pilot",
  "created_at": "2000-01-01T00:00:00Z",
  "purpose": "TEMPLATE: replace with the specific system boundary, initialization, trigger, completion, exclusions, and reset procedure before freezing.",
  "sample_plan": {
    "seeds": [
      0,
      1
    ],
    "repetitions_per_seed": 2
  },
  "timeout": {
    "seconds": 60,
    "clock": "monotonic",
    "policy": "record_timeout"
  },
  "metrics": [
    {
      "name": "cycle_seconds",
      "unit": "s",
      "description": "TEMPLATE: elapsed simulation time from prescribed trigger to completion; define exact events.",
      "denominator": "One initiated synthetic cycle; timed out or missing cycles remain recorded.",
      "aggregation": "single",
      "clock": "simulation",
      "missing_policy": "record_missing"
    }
  ]
}
